ID,Pathway ID,Preference,Reasoning_Preference,Control,Experience,Age,Sex,Necessity ,Reasoning_Necessity,Time
191,answer-4wtf2lviki8b3,Тип №3,"Потому что четко прописано, что недостоверная инфа, а так же ниже приведено объяснение",4,Нет,29,Женщина,Да,"Потому что, люди в большинстве своем доверяют всякому бреду, не фильтруя инфу",144042
192,answer-gbej2lvikih2z,Тип №4,"Мне понравилось, что есть полное объяснение почему публикация считается недостоверной. При этом есть возможность выбрать читать эту информацию и в каком объёме.",4,Нет,42,Женщина,Да,"Не все люди интересуются происходящим вокруг и не всегда критически воспринимают входящую информацию, и могут быть введены в заблуждение. Предупреждение может заставить их задуматься лишний раз и избежать неверных суждений.",429310
193,answer-4wtf2lvikilco,Тип №3,"Короткая четкая фраза предупреждение. А так же что можно ознакомится с дополнительной информацией , если это интересно человеку. Еще понравилось что доп. информация не бледная , как в других вариантах , это улучшает ее читабельность.",4,Нет,41,Женщина,Да,"да, так как в интернете очень много сейчас фейков, а данное предупреждение заставит задуматься и более глубоко изучить вопрос.",491245
194,answer-gbej2lvikj1jj,Тип №4,в этом варианте максимально расписаны причины блокировки,4,Нет,36,Женщина,Да,"да, потому что я не люблю вранье и дезинформацию ",178901
195,answer-gbej2lvikj72j,Тип №3,"В этом варианте плашка с предупреждением видна наиболее хорошо, а потом дается подробное объяснение, чем пост может оказаться вреден. Вообще плашку с предупреждением надо размещать ДО начала поста, чтобы пользователь был заранее предупрежден",4,Нет,40,Мужчина,Да,"В сети слишком много вредной информации и инфлюенсеров, которые ее разносят. Обязательно нужно предупреждать людей, чтобы они были предупреждены",205418
196,answer-gbej2lvikjeu6,Тип №1,"легче читать

",3,Да,18,Мужчина,Да,"не знаю

",107169
197,answer-gbej2lvikkm9f,Тип №1,Самое информативное предупреждение из предложенных,3,Да,28,Мужчина,Да,"
",81865
198,answer-4wtf2lvikollo,Тип №3,Ясность,4,Да,27,Мужчина,Нет,Достоверность,43871
199,answer-4wtf2lviks5bp,Тип №1,"выбираю этот пост, потому что важно включать свое критическое мышление! и хорошо когда об этом напоминают)",4,Нет,47,Женщина,Да,"да, потому что важно думать, прежде чем верить всему что пишут и говорят.",424232
200,answer-4wtf2lviku0n9,Тип №1,более развернут ответ,3,Нет,45,Мужчина,Да,чтобы знать что сообщения не из достоверных источников,187184
201,answer-gbej2lviku56t,Тип №4,более подробно,4,Нет,38,Мужчина,Да,меньше мусорного контента,251173
202,answer-gbej2lviku5c2,Тип №3,Для меня они все одинаковые,4,Да,29,Мужчина,Да,Есть люди которые слабо понимают в безопасности,121959
203,answer-gbej2lviku80y,Тип №2,"Броско и лаконично, нет лишней воды, все понятно и притягивает внимание.",4,Нет,26,Мужчина,Да,"Ну очевидно, что это полезная информация",127236
204,answer-4wtf2lviku95n,Тип №2,2 - коротко и ясно,4,Нет,43,Мужчина,Да,многие люди доверчивы всему,148505
205,answer-gbej2lvikuekq,Тип №1,"Когда плашка скрывает текст поста ее невозможно пропустить, что делает ее максимально полезной",4,Нет,26,Мужчина,Нет,Слишком много работы для соц сети ради ничего,486918
206,answer-gbej2lvikuet7,Тип №3,"приводится подробное объяснение, почему статья может содержать ложную информацию",4,Нет,40,Мужчина,Да,поможет предотвратить преступления связанные с фейк информацией,117884
207,answer-gbej2lvikuf3f,Тип №4,понятнее текст,4,Нет,22,Женщина,Нет,нет потому что это может быть спам,175850
208,answer-gbej2lvikughe,Тип №4,"Все варианты подсказок(объяснений) вынесены в отдельные шапки в блоке, что делать страницу меньше и делает доступным все объяснения на одном экране(странице) без скроллинга, что экономит время и клики",3,Нет,30,Мужчина,Да,"Пояснения всегда полезны, а уж решать человек будем сам.",296664
209,answer-gbej2lvikumno,Тип №4,"Предупреждение стоит вначале, его хорошо видно.",4,Нет,38,Мужчина,Other,"Вопрос сложный, с одной стороны это конечно полезно, с другой стороны многих это предупреждение либо просто оттолкнет от поста, либо заставит изначально относится к информации в посте с недоверием. не совсем понятно, по какому принципу это предупреждение выставляется, поэтому сложно ответить на этот вопрос однозначно.",520203
210,answer-4wtf2lvikv7fs,Тип №2,визуально более приятный и ненавязчивый вариант с предупреждением,4,Нет,33,Женщина,Нет,думаю человек сам может сделать вывод,312135
211,answer-4wtf2lvikvwis,Тип №3,"Дополнительные пояснения на одной страничке, их можно скрыть - открыть. очень удобно что не отображается отдельном окне доп. информация. Для меня было бы достаточно пометки красным о возможно недостоверной информации. ",4,Да,31,Женщина,Да,"Сейчас очень много недостоверной информации в интернете, особенно важные новости СМИ. Было бы отлично если бы была пометка официальной информации о событиях.",278654
212,answer-4wtf2lvikw6id,Тип №4,Потому что предупреждается  именно о чем пост  может содержать недостоврную информацию,4,Да,46,Мужчина,Да,"Для предупреждения, что пост  может  обманывать.",235122
213,answer-gbej2lvikwqgh,Тип №2,просто и действенно,4,Нет,28,Женщина,Нет,каждый сам решает что читает. смысла нет,95317
214,answer-4wtf2lvikzuv1,Тип №4,более подробно,4,Нет,38,Мужчина,Да,потому что не желательное,178676
215,answer-4wtf2lvil4veu,Тип №1,"Коротко и ясно, плюсом то, что доступ к посту сразу закрыт",5,Нет,31,Женщина,Да,"Потому что пользователю сразу поясняют, что этот пост может быть небезопасен",453625
216,answer-gbej2lvilk7e7,Тип №3,"Все коротко и ясно,не нужно долго и много читать",4,Нет,23,Мужчина,Да,Много людей которые ведутся на фейки и верят этому,80945
217,answer-4g22lvjfl3ua,Тип №2,"Крупнее. Открывается только тем, кому действительно интересно. Экономит пространство в сети Интернет.",5,Да,31,Женщина,Да,Потому что люди очень доверчивые. Главное чтобы не помечались посты такой меткой с достоверной информацией.,136661
218,answer-4j4jz2lvjfl4yc,Тип №2,"кратко, лаконично",4,Нет,48,Женщина,Да,полезно для пользователя,61632
219,answer-4j4jz2lvjfl5ag,Тип №2,"Я бы предпочла сначала прочитать сообщение, а затем увидеть предупреждение. Причина - я хочу сама оценить насколько информация правдоподобна.",4,Нет,39,Женщина,Other,"нет - потому что непонятно, кто решил, что информация недостоврена",159715
220,answer-4j4jz2lvjfl6jj,Тип №4,"понравилось, что есть подробное описание. и на мой взгляд из всех представленных типов этот наиболее подробный, понятный и качественный",2,Да,19,Женщина,Да,потому что в интернете много недостоверной информации и следует помечать такой контент соответсвующими маркерами,158353
221,answer-4g22lvjfl71y,Тип №3,"кратко написано предупреждение, а кого заинтересует может почитать причину",4,Нет,37,Женщина,Да,не встречала такие посты или не замечала,334025
222,answer-4g22lvjfl8di,Тип №4,на мой взгляд лучший вариант,3,Нет,27,Мужчина,Да,чтобы обезопасить людей,54586
223,answer-4g22lvjflagi,Тип №3,"Под предупреждением о недостоверной информации имеется пояснение с официальными данными по вопросу, обсуждаемому в посте. Это помогает бороться с заблуждениями и домыслами ",4,Нет,36,Мужчина,Да,"Да, потому что в информационной среде много недостоверной информации",268169
224,answer-4g22lvjflahb,Тип №3,"не нужно никуда дополнительно нажимать, чтобы прочитать пост, при этом пометка стоит перед текстом",4,Нет,32,Мужчина,Да,"чтобы люди не велись на фейк ньюс, считаю что такие пометки нужны",131867
225,answer-4g22lvjflbq2,Тип №1,предупреждение вначале и текста не слишком много,2,Да,42,Женщина,Да,Чтобы распознать заранее недостоверный контент,172366
226,answer-4j4jz2lvjflcgd,Тип №3,"Видно сам пост, можно ознакомиться, есть весьма заметное предупреждение о возможной недостоверности этого поста, так же имеется весьма подробное пояснение что не так, выглядит удобочитаемым.",4,Да,36,Мужчина,Да,"Помечать все подряд кажется излишним, но некоторые сообщения могут нанести реальный вред здоровью, особенно на медицинские темы, таким надо пояснять, что это не истина в последней инстанции.",370527
227,answer-4g22lvjfldd2,Тип №3,"потому что ответ на комментарий развернутый, не оскорбительный, но при этом полностью опровергает написанное автором",4,Нет,39,Женщина,Да,"нужно, чтобы не вводить в заблуждение тех, кто это прочтет",297531
228,answer-4j4jz2lvjfldm3,Тип №2,"все кратко и понятно, нет лишней инфы. и каждый сам решает делать то, что считает нужным и правильным ",4,Нет,39,Женщина,Да,"я думаю, что это именно для меня важно. чтобы сопоставить то, что написано с предупреждением и проанализировать ",264835
229,answer-4j4jz2lvjflf6u,Тип №1,"Информация отображена кратко, емко и понятно. Человек не готов уделять время длинным текстам, поэтому воспринимать более короткую, но "" по делу"" информацию проще",3,Да,29,Женщина,Да,"потому что в настоящее время люди слишком доверяют тому, что написано в Сети и предупреждения помогают более тщательно фильтровать получаемую информацию",166434
230,answer-4j4jz2lvjflfwo,Тип №2,"Просто предупреждения достаточно, подробно мало кто будет читать",4,Нет,34,Мужчина,Да,"Если посты могут нести вред здоровье, нужно пометить",244738
231,answer-4j4jz2lvjflgsi,Тип №1,Оптимально обозначено почему в тексте может содержаться недостоверная информация. И расписано это кратко,4,Нет,41,Женщина,Да,"Что бы люди понимали, что не стоит доверять всей информации встречающейся в соцсетях",235110
232,answer-4g22lvjflhvy,Тип №4,вариант 4 раскрывает более подробную информацию о том почему информация является не верной и есть контраргумент а так же есть обратная связь если есть неоспоримые  доказательства  у автора статьи,4,Да,36,Мужчина,Да,потому что нужно предупреждать о статьях в вводящих заблуждение,718813
233,answer-4j4jz2lvjflkuu,Тип №3,"Мне понравился больше этот вариант. Здесь можно прочитать сообщение пользователя, а под плашкой предупреждения почитать информацию о вакцинах. В Тип1 нельзя прочитать сообщение пользователя. В Тип2 просто предупреждение без разъяснений. Тип4 в целом понравился, но не видно сообщение пользователя. Было бы хорошо скомбинировать Тип4 и Тип3.",4,Да,34,Женщина,Да,"В целом было бы неплохо к подобным сообщениям ставить пометку, но пользователь уже сам должен решать полезна ему эта информация, согласен ли он с ней или нет.",465586
234,answer-4j4jz2lvjfllit,Тип №1,"Уместно предупредить о недостоверной информации ДО текста, чем после.",4,Да,33,Женщина,Да,"Потому что очевидное очевидно не для всех. Важно отмечать, что информация касается лженауки, конспирологии и т.д.",398576
235,answer-4j4jz2lvjfllqx,Тип №1,"Кратко, не вызывает дальнейших вопросов. Человек сам выберет, надо ему читать такой контент или нет. Еще неплохой ответ под номером 3, когда расписаны аргументы, подтверждающие некорректность суждения, но неплохо было бы указать источник сведений.",4,Да,46,Женщина,Да,"Хотя бы потому что, человек задумается о правдивости представленной информации. А дальше уже дело за ним, верить или включать критическое мышление и искать ответы.",543513
236,answer-4j4jz2lvjflm7l,Тип №4,более развернутая дополнительная информация,4,Нет,39,Мужчина,Да,люди должны быть проинформированы,156181
237,answer-4g22lvjfln1k,Тип №4,больше всего вариантов и закрыть можно и отправить жалобу а не просто предупрежение,4,Нет,30,Мужчина,Нет,можно манипулировать точкой зрения нужной повесткой,256337
238,answer-4j4jz2lvjflqek,Тип №1,Более точно и быстро дает понять почему этот пост нежелатилен к прочтению. При этом закрывает пост и при желании лишь можно его открыть,5,Нет,22,Женщина,Да,Считаю это очень полезным. Помогает лишний раз не наткнуться на недостоверную информацию,295668
239,answer-4j4jz2lvjflqyu,Тип №3,3 тип потому что дает дополнительные пояснения,3,Нет,25,Женщина,Да,"потому что в современном мире много статей и новостей с недостоверной информацией, а также просто с мыслями и рассуждениями, и некоторые люди воспринимают любую информацию как истину, без фильтрации",485604
240,answer-4g22lvjflz6x,Тип №4,"Этот вариант считаю лучшим, потому что предупреждение в нём находится перед текстом сообщения и таким образом лучше обращает на себя внимание. В то же время само сообщение не закрыто от пользователя, как в варианте №4, и читатель сразу может составить примерное представление о его содержании.",4,Нет,40,Женщина,Да,"В интернете слишком много информации, в том числе недостоверной. Я считаю, что подобные сообщения помогут пользователю более критично относиться к содержанию того, что он читает, а также упростят ему поиск источника информации.",455491
241,answer-4j4jz2lvjfmhfa,Тип №1,"Потому что  там предупреждаю, что контент не достоверную информацию запостил    ",4,Нет,40,Женщина,Да,Потому что так точно будем знать  что это не достоверная информация,385938
242,answer-4g22lvjfmivv,Тип №1,Вариант с подробным описанием о мошенничестве представлен в этом варианте .,2,Да,30,Женщина,Да,Информации нужна дополнительная информация о предупреждения о мошенничестве.,133739
243,answer-4j4jz2lvjfmjrk,Тип №3,"потому что ничего лишнего, просто объяснения почему это не так, и подтверждающий факт",4,Да,26,Мужчина,Да,потому что много недостоверной информации в интернете и многие люди в это верят,78820
244,answer-4g22lvjfnqxt,Тип №3,Так удобнее воспринимать информацию,4,Да,39,Женщина,Да,Чтобы быть начеку,101682
245,answer-4g22lvjfntea,Тип №1,"в этом варианте пользователь сначала прочитает предупреждение и задумается, а в первом варианте наоборот (такое предупреждение может не сильно повлиять на восприятие)",3,Нет,38,Женщина,Да,"не все имеют критическое мышление и иногда человека важно предупредить о том, что ему предстоит прочитать, чтобы он задумался",285108
246,answer-4j4jz2lvjfpo7g,Тип №4,"Этот вариант более полный по информации почему он отмечен предупреждением, также полезно узнать опровержение поста и если есть вопросы по нему можно обратится к поддержке",4,Да,35,Женщина,Да,"От предупреждения будет больше пользы, это не даст ввести в заблуждение",625766
247,answer-4g22lvjftktr,Тип №4,подробно написано,4,Да,41,Мужчина,Да,сомневался,176704
248,answer-4j4jz2lvjg0qyx,Тип №3,более понятное обьяснение,4,Да,33,Женщина,Да,потому что это защитит от недобросовестных людей,92205
249,answer-4j4jz2lvjgc7k6,Тип №3,"Много информации, которая подтверждает недостоверность поста",4,Да,42,Женщина,Да,"Потому что люди не должны верить всей информации, предоставленной в интернете",159607